{
  "schema_version": 1,
  "scenario_id": "manual-elasticsearch-drift",
  "runner_run_id": "79acce96-934d-4b14-a7b1-53511fa10240",
  "declared_fault": {
    "type": "DATA",
    "target": "products-write",
    "action": "delete one document and corrupt one same-revision document"
  },
  "cleanup_registered_before_fault": true,
  "observed_intermediate_states": [
    "DEGRADED"
  ],
  "case_observations": {
    "scenario_id": "manual-elasticsearch-drift",
    "artifacts": [
      {
        "path": "corrupt-es.json",
        "sha256": "d87fa0ba9112be3210b740444e59c8b2976c7857da0c4545bb3657e97bb94221",
        "json": {
          "_index": "products_v2",
          "_id": "7202",
          "_version": 1,
          "result": "updated",
          "_shards": {
            "total": 1,
            "successful": 1,
            "failed": 0
          },
          "_seq_no": 3,
          "_primary_term": 1
        }
      },
      {
        "path": "create-missing-http.json",
        "sha256": "d903919e53ef6f310dc64d39921c6098a60d48cae4a0099840c0cfeb5b397054",
        "json": {
          "transport_exit": 0,
          "http_status": 201,
          "json_valid": true,
          "raw_body": "{\"productId\":7201,\"revision\":1}"
        }
      },
      {
        "path": "create-missing.json",
        "sha256": "6a3276bade41c15390170109621c1f74e88abaeafb9a7dfccc639d81d8896d16",
        "json": {
          "productId": 7201,
          "revision": 1
        }
      },
      {
        "path": "create-modified-http.json",
        "sha256": "96990585dcc2d2ea5316e807afe57b304a4d0b6ca5b7e249125df31217888f34",
        "json": {
          "transport_exit": 0,
          "http_status": 201,
          "json_valid": true,
          "raw_body": "{\"productId\":7202,\"revision\":1}"
        }
      },
      {
        "path": "create-modified.json",
        "sha256": "e7a587bd565c726d9ed18f4bc91e82b824e588b2891a6aeb6100984f0238484d",
        "json": {
          "productId": 7202,
          "revision": 1
        }
      },
      {
        "path": "delete-es.json",
        "sha256": "a5e11aca793b61223eab30c79bf3a5af84d914cc5d6a5cb16927d6a3dfb675d5",
        "json": {
          "_index": "products_v2",
          "_id": "7201",
          "_version": 1,
          "result": "deleted",
          "_shards": {
            "total": 1,
            "successful": 1,
            "failed": 0
          },
          "_seq_no": 2,
          "_primary_term": 1
        }
      },
      {
        "path": "diff-run.json",
        "sha256": "c5a92f9ef6cc1a1ecc26334805f56b30d6750ad36b8137d921d732624821ae59",
        "json": {
          "runId": "42f70d3c-b82c-432d-a352-557050b1dfbd",
          "target": "products_write",
          "status": "DIFF",
          "sourceWatermarkStart": 2,
          "sourceWatermarkEnd": 2,
          "expectedCount": 2,
          "actualCount": 1,
          "differenceCount": 2,
          "counts": {
            "MISSING": 1,
            "MODIFIED": 1
          },
          "failureClass": null,
          "failureMessage": null
        }
      },
      {
        "path": "differences.json",
        "sha256": "b31ca653223784470a318cfbaaf4a6b3a89b5cc85beb45d5954046ca516fdc29",
        "json": [
          {
            "type": "MISSING",
            "fields": [],
            "product_id": 7201
          },
          {
            "type": "MODIFIED",
            "fields": [
              {
                "field": "name",
                "actualValue": "manual-corruption",
                "expectedValue": "Crash 7202"
              }
            ],
            "product_id": 7202
          }
        ]
      },
      {
        "path": "es-original.json",
        "sha256": "e25fde54475279433c80a6dbaa7e7929f2713045009ae9b3f7ec2a4d302c860d",
        "json": {
          "_index": "products_v2",
          "_id": "7202",
          "_version": 1,
          "_seq_no": 1,
          "_primary_term": 1,
          "found": true,
          "_source": {
            "product_id": 7202,
            "sku": "LAB-7202",
            "name": "Crash 7202",
            "description": "fixture",
            "category_id": 10,
            "category_name": "Accessories",
            "price_cents": 100,
            "available_quantity": 0,
            "searchable": true,
            "source_revision": 1,
            "source_updated_at": "2026-07-30T03:59:43.460960Z"
          }
        }
      },
      {
        "path": "final-pipeline-status.json",
        "sha256": "a53abe0245b5442c647b9b97ea8cada7b6fab43b3b55218df87f8d92f408796f",
        "json": {
          "state": "HEALTHY",
          "kafkaLag": 0,
          "allPartitionsCommitted": true,
          "partitions": [
            {
              "topic": "product-search-revisions",
              "partition": 0,
              "committedOffset": 1,
              "beginningOffset": 0,
              "endOffset": 1,
              "lag": 0,
              "retentionGap": false
            },
            {
              "topic": "product-search-revisions",
              "partition": 1,
              "committedOffset": 1,
              "beginningOffset": 0,
              "endOffset": 1,
              "lag": 0,
              "retentionGap": false
            },
            {
              "topic": "product-search-revisions",
              "partition": 2,
              "committedOffset": 1,
              "beginningOffset": 0,
              "endOffset": 1,
              "lag": 0,
              "retentionGap": false
            }
          ],
          "unresolvedDlq": 0,
          "latestRunId": "941a6f42-4d7c-4d06-ba3b-4415be0452cb",
          "latestRunStatus": "PASS",
          "latestDifferenceCount": 0,
          "latestRunFinishedAt": "2026-07-30T03:59:51.757450Z",
          "latestSuccessfulPassFinishedAt": "2026-07-30T03:59:51.757450Z",
          "activeConditions": [],
          "evaluatedAt": "2026-07-30T03:59:52.403879781Z"
        }
      },
      {
        "path": "final-product-dlq.json",
        "sha256": "e8ae26c00979b954051d4b766f15f9a9bb144943e999457558acaa8e39a2d73d",
        "json": {
          "unresolved": 0
        }
      },
      {
        "path": "final-record-dlq.json",
        "sha256": "e8ae26c00979b954051d4b766f15f9a9bb144943e999457558acaa8e39a2d73d",
        "json": {
          "unresolved": 0
        }
      },
      {
        "path": "final-refresh.json",
        "sha256": "a0f2dca20b849cd7f450630e46f354a7c8ce627a7fed9374281006b79c555731",
        "json": {
          "_shards": {
            "total": 1,
            "successful": 1,
            "failed": 0
          }
        }
      },
      {
        "path": "final-verification.json",
        "sha256": "7edad4d117a52378d903769ab779cf22cf7082307a24332304af7415f75eb478",
        "json": {
          "runId": "941a6f42-4d7c-4d06-ba3b-4415be0452cb",
          "target": "products_write",
          "status": "PASS",
          "sourceWatermarkStart": 2,
          "sourceWatermarkEnd": 2,
          "expectedCount": 2,
          "actualCount": 2,
          "differenceCount": 0,
          "counts": {},
          "failureClass": null,
          "failureMessage": null
        }
      },
      {
        "path": "fresh-pass.json",
        "sha256": "21c49b99f13147e933e4027b144fd854b3805c1e9dc497989f3d6be3d3fb2875",
        "json": {
          "runId": "629ceb7a-a83b-48d8-b276-5cb62546cdbc",
          "target": "products_write",
          "status": "PASS",
          "sourceWatermarkStart": 2,
          "sourceWatermarkEnd": 2,
          "expectedCount": 2,
          "actualCount": 2,
          "differenceCount": 0,
          "counts": {},
          "failureClass": null,
          "failureMessage": null
        }
      },
      {
        "path": "repair-actions.json",
        "sha256": "3aae6e7f81c36045bf4b5a9442945d7f783af9c6882ddbf1615485f5db559f68",
        "json": [
          {
            "outcome": "APPLIED",
            "product_id": 7201,
            "action_type": "WRITE_EXTERNAL_GTE"
          },
          {
            "outcome": "APPLIED",
            "product_id": 7202,
            "action_type": "WRITE_EXTERNAL_GTE"
          }
        ]
      },
      {
        "path": "repair.json",
        "sha256": "ad8d98b74823b2dd50da59a305ce650b1dc8ebff261dcff32b6c38969aa75e0c",
        "json": {
          "runId": "42f70d3c-b82c-432d-a352-557050b1dfbd",
          "sourceWatermarkStart": 2,
          "sourceWatermarkEnd": 2,
          "applied": 2,
          "stale": 0,
          "skipped": 0,
          "failed": 0,
          "sourceStable": true,
          "repaired": true
        }
      }
    ]
  }
}
