{
  "schema_version": 1,
  "scenario_id": "category-rename-multi-product",
  "runner_run_id": "828f1f77-56c6-40a9-af00-a5f2a868b198",
  "declared_fault": {
    "type": "DATA",
    "target": "mysql-category",
    "action": "rename the category in one source transaction"
  },
  "cleanup_registered_before_fault": true,
  "observed_intermediate_states": [
    "CATCHING_UP"
  ],
  "case_observations": {
    "scenario_id": "category-rename-multi-product",
    "artifacts": [
      {
        "path": "consumer-restarted.json",
        "sha256": "ca7f6a9cb576398bda08fa296ea0f5c708e3059eb33e6135f2674ebae08da3a7",
        "json": {
          "transport_exit": 0,
          "http_status": 200,
          "json_valid": true,
          "raw_body": "{\"groups\":[\"liveness\",\"readiness\"],\"status\":\"UP\"}",
          "consumer_container_id": "d88314ec96beccd1ef7595cfbb61ec7ac5974292a51600127f519b6b27f4565b",
          "container_started_at": "2026-07-30T04:02:19.675706738Z",
          "observed_at": "2026-07-30T04:02:25Z"
        }
      },
      {
        "path": "consumer-stopped.json",
        "sha256": "a17fcf0a2f50e2d495e4f90ce263410edc183add6c62699a2facbccf60410f74",
        "json": true
      },
      {
        "path": "create-1-http.json",
        "sha256": "2d5516123c8710901a4a825a400e9b612fb66e852162eaea4a50b2b2271a8203",
        "json": {
          "transport_exit": 0,
          "http_status": 201,
          "json_valid": true,
          "raw_body": "{\"productId\":7301,\"revision\":1}"
        }
      },
      {
        "path": "create-1.json",
        "sha256": "085274775efac841d4c97ae101cd8d00ab276852abfed0ba0950909c734966c7",
        "json": {
          "productId": 7301,
          "revision": 1
        }
      },
      {
        "path": "create-2-http.json",
        "sha256": "90a80eb10b6acce96e5d40f0a9f9808cf1b64b7fe67c27f575933ce809fdad05",
        "json": {
          "transport_exit": 0,
          "http_status": 201,
          "json_valid": true,
          "raw_body": "{\"productId\":7304,\"revision\":1}"
        }
      },
      {
        "path": "create-2.json",
        "sha256": "1a508503860fc1bf96a10dd61a70c58d417e3a6f87e84a09931f2b273dda6fdc",
        "json": {
          "productId": 7304,
          "revision": 1
        }
      },
      {
        "path": "create-3-http.json",
        "sha256": "d4cb8258b199bdc97864a5f51066a4ce1a7892c40167dda800b13f356d09e11d",
        "json": {
          "transport_exit": 0,
          "http_status": 201,
          "json_valid": true,
          "raw_body": "{\"productId\":7307,\"revision\":1}"
        }
      },
      {
        "path": "create-3.json",
        "sha256": "b333b044ff395677a8b81e3b1399a8b7d7945f590ba8646f76aa4c05a37bfb5b",
        "json": {
          "productId": 7307,
          "revision": 1
        }
      },
      {
        "path": "final-pipeline-status.json",
        "sha256": "0f38ed3fe20f345cf24f2739a1ac14d464b04a2f440f164192f2ee439abb1040",
        "json": {
          "state": "HEALTHY",
          "kafkaLag": 0,
          "allPartitionsCommitted": true,
          "partitions": [
            {
              "topic": "product-search-revisions",
              "partition": 0,
              "committedOffset": 1,
              "beginningOffset": 0,
              "endOffset": 1,
              "lag": 0,
              "retentionGap": false
            },
            {
              "topic": "product-search-revisions",
              "partition": 1,
              "committedOffset": null,
              "beginningOffset": 0,
              "endOffset": 0,
              "lag": 0,
              "retentionGap": false
            },
            {
              "topic": "product-search-revisions",
              "partition": 2,
              "committedOffset": 4,
              "beginningOffset": 0,
              "endOffset": 4,
              "lag": 0,
              "retentionGap": false
            }
          ],
          "unresolvedDlq": 0,
          "latestRunId": "a101c3a6-f3bc-4583-90a8-a2b19a6bde5b",
          "latestRunStatus": "PASS",
          "latestDifferenceCount": 0,
          "latestRunFinishedAt": "2026-07-30T04:02:30.694185Z",
          "latestSuccessfulPassFinishedAt": "2026-07-30T04:02:30.694185Z",
          "activeConditions": [],
          "evaluatedAt": "2026-07-30T04:02:30.804750932Z"
        }
      },
      {
        "path": "final-product-dlq.json",
        "sha256": "e8ae26c00979b954051d4b766f15f9a9bb144943e999457558acaa8e39a2d73d",
        "json": {
          "unresolved": 0
        }
      },
      {
        "path": "final-record-dlq.json",
        "sha256": "e8ae26c00979b954051d4b766f15f9a9bb144943e999457558acaa8e39a2d73d",
        "json": {
          "unresolved": 0
        }
      },
      {
        "path": "final-refresh.json",
        "sha256": "a0f2dca20b849cd7f450630e46f354a7c8ce627a7fed9374281006b79c555731",
        "json": {
          "_shards": {
            "total": 1,
            "successful": 1,
            "failed": 0
          }
        }
      },
      {
        "path": "final-verification.json",
        "sha256": "c5763513ea72c14e589d67d3c371fe86d011003af1ecf12d57f8c7fe97b972b0",
        "json": {
          "runId": "a101c3a6-f3bc-4583-90a8-a2b19a6bde5b",
          "target": "products_write",
          "status": "PASS",
          "sourceWatermarkStart": 4,
          "sourceWatermarkEnd": 4,
          "expectedCount": 3,
          "actualCount": 3,
          "differenceCount": 0,
          "counts": {},
          "failureClass": null,
          "failureMessage": null
        }
      },
      {
        "path": "group-before.json",
        "sha256": "92f3933ddc97568ef2e9d5a12dd46bdb09523fc1c22f5496d257a5ba012a2202",
        "json": [
          {
            "partition": 0,
            "committed": 1,
            "end": 1,
            "lag": 0
          },
          {
            "partition": 1,
            "committed": 0,
            "end": 0,
            "lag": 0
          },
          {
            "partition": 2,
            "committed": 3,
            "end": 3,
            "lag": 0
          }
        ]
      },
      {
        "path": "rename.json",
        "sha256": "1121cfccd5913f0a63fec40a6ffd44ea64f9dc135c66634ba001d10bcf4302a2",
        "json": 3
      },
      {
        "path": "source-after.json",
        "sha256": "77004da9ac77df8985bc0052e6d23e99e1679e9cecb62ec285c55d153408af9b",
        "json": [
          {
            "revision": 2,
            "product_id": 7301,
            "updated_at": "2026-07-30T04:02:02.001434Z"
          },
          {
            "revision": 2,
            "product_id": 7304,
            "updated_at": "2026-07-30T04:02:02.001434Z"
          },
          {
            "revision": 2,
            "product_id": 7307,
            "updated_at": "2026-07-30T04:02:02.001434Z"
          }
        ]
      },
      {
        "path": "source-before.json",
        "sha256": "1e3ce14aca05d24fc9b51810c0ce10a206498feb6fc17cb0c49aec59917028a0",
        "json": [
          {
            "revision": 1,
            "product_id": 7301,
            "updated_at": "2026-07-30T04:01:49.616202Z"
          },
          {
            "revision": 1,
            "product_id": 7304,
            "updated_at": "2026-07-30T04:01:52.810650Z"
          },
          {
            "revision": 1,
            "product_id": 7307,
            "updated_at": "2026-07-30T04:01:55.789779Z"
          }
        ]
      },
      {
        "path": "three-row-record.json",
        "sha256": "a17fcf0a2f50e2d495e4f90ce263410edc183add6c62699a2facbccf60410f74",
        "json": true
      }
    ]
  }
}
