{"schema_version":1,"scenario_id":"manual-elasticsearch-drift","runner_run_id":"11111111-1111-4111-8111-111111111111","declared_fault":{"type":"fixture"},"cleanup_registered_before_fault":true,"observed_intermediate_states":["DEGRADED"],"case_observations":{"scenario_id":"manual-elasticsearch-drift","artifacts":[{"path":"diff-run.json","sha256":"ffb132d01a9eba22d64ce22377ce499d018f16b57f03bce80deba2d78295d41c","json":{"status":"DIFF","counts":{"MISSING":1,"MODIFIED":1}}},{"path":"differences.json","sha256":"fe0139d6f84144f711910c0c2000fa4aefe5cb4aa3c75fd0882fcdcee089c8a9","json":[{"type":"MISSING"},{"type":"MODIFIED"}]},{"path":"repair.json","sha256":"8d7c452a0fbb96564de1c8c02a7e05438962ed4a38c262ab32c8cb316caa1df7","json":{"repaired":true,"applied":2}},{"path":"fresh-pass.json","sha256":"6dc8b995b0471b21680000b8038c0aa8de11f4a13ce4c9897c3058fae731957c","json":{"status":"PASS","differenceCount":0}}]}}
