{
  "schema_version": 1,
  "scenario_id": "canal-normal-restart",
  "runner_run_id": "991c0cbc-559e-4f31-9ea0-9d0dff9694aa",
  "declared_fault": {
    "type": "PROCESS",
    "target": "canal",
    "action": "restart after acknowledged cursor capture"
  },
  "cleanup_registered_before_fault": true,
  "observed_intermediate_states": [
    "CATCHING_UP"
  ],
  "case_observations": {
    "scenario_id": "canal-normal-restart",
    "artifacts": [
      {
        "path": "consumer-restarted.json",
        "sha256": "04cc95f8b262603fc41eb6d9b97639ce2e378a2037398e903f712c6ba92c7bed",
        "json": {
          "transport_exit": 0,
          "http_status": 200,
          "json_valid": true,
          "raw_body": "{\"groups\":[\"liveness\",\"readiness\"],\"status\":\"UP\"}",
          "consumer_container_id": "117b4164df320ab53f1de2debc2b4cea6ff0fce227292056a1fd55335f085ad1",
          "container_started_at": "2026-07-30T03:28:21.047943707Z",
          "observed_at": "2026-07-30T03:28:28Z"
        }
      },
      {
        "path": "consumer-stopped.json",
        "sha256": "a17fcf0a2f50e2d495e4f90ce263410edc183add6c62699a2facbccf60410f74",
        "json": true
      },
      {
        "path": "create-http.json",
        "sha256": "f81909b1a1522ba573e4a13925926fc1006810303e21d9894639da9afe237e31",
        "json": {
          "transport_exit": 0,
          "http_status": 201,
          "json_valid": true,
          "raw_body": "{\"productId\":6101,\"revision\":1}"
        }
      },
      {
        "path": "create.json",
        "sha256": "15c97eea74d3169c99f6d7f736074d8ccd55f598ec95d6e70d77478c589bf052",
        "json": {
          "productId": 6101,
          "revision": 1
        }
      },
      {
        "path": "end-after-restart.json",
        "sha256": "36e2b624a9171799e1fa92065f99cfc64e6ad0a64feb871f931849c8d4eb6692",
        "json": {
          "0": 1,
          "1": 0,
          "2": 1
        }
      },
      {
        "path": "end-before.json",
        "sha256": "36e2b624a9171799e1fa92065f99cfc64e6ad0a64feb871f931849c8d4eb6692",
        "json": {
          "0": 1,
          "1": 0,
          "2": 1
        }
      },
      {
        "path": "es-final.json",
        "sha256": "c9e7f6f6aa07667e67880df846349217ca29ca2c9218acf7cb20f781d2d568e2",
        "json": {
          "transport_exit": 0,
          "http_status": 200,
          "json_valid": true,
          "raw_body": "{\"_index\":\"products_v2\",\"_id\":\"6101\",\"_version\":2,\"_seq_no\":1,\"_primary_term\":1,\"found\":true,\"_source\":{\"product_id\":6101,\"sku\":\"LAB-6101\",\"name\":\"Crash 6101\",\"description\":\"fixture\",\"category_id\":10,\"category_name\":\"Accessories\",\"price_cents\":61101,\"available_quantity\":0,\"searchable\":true,\"source_revision\":2,\"source_updated_at\":\"2026-07-30T03:27:49.925647Z\"}}"
        }
      },
      {
        "path": "final-pipeline-status.json",
        "sha256": "a6ee519ad3b52586d9bd001e740cb8d66384a93ca96727ee3c5741a2df10cfc6",
        "json": {
          "state": "HEALTHY",
          "kafkaLag": 0,
          "allPartitionsCommitted": true,
          "partitions": [
            {
              "topic": "product-search-revisions",
              "partition": 0,
              "committedOffset": 1,
              "beginningOffset": 0,
              "endOffset": 1,
              "lag": 0,
              "retentionGap": false
            },
            {
              "topic": "product-search-revisions",
              "partition": 1,
              "committedOffset": null,
              "beginningOffset": 0,
              "endOffset": 0,
              "lag": 0,
              "retentionGap": false
            },
            {
              "topic": "product-search-revisions",
              "partition": 2,
              "committedOffset": 2,
              "beginningOffset": 0,
              "endOffset": 2,
              "lag": 0,
              "retentionGap": false
            }
          ],
          "unresolvedDlq": 0,
          "latestRunId": "1797b231-84df-4ade-9337-81f99845c0fd",
          "latestRunStatus": "PASS",
          "latestDifferenceCount": 0,
          "latestRunFinishedAt": "2026-07-30T03:28:34.234034Z",
          "latestSuccessfulPassFinishedAt": "2026-07-30T03:28:34.234034Z",
          "activeConditions": [],
          "evaluatedAt": "2026-07-30T03:28:34.446889830Z"
        }
      },
      {
        "path": "final-product-dlq.json",
        "sha256": "e8ae26c00979b954051d4b766f15f9a9bb144943e999457558acaa8e39a2d73d",
        "json": {
          "unresolved": 0
        }
      },
      {
        "path": "final-record-dlq.json",
        "sha256": "e8ae26c00979b954051d4b766f15f9a9bb144943e999457558acaa8e39a2d73d",
        "json": {
          "unresolved": 0
        }
      },
      {
        "path": "final-refresh.json",
        "sha256": "a0f2dca20b849cd7f450630e46f354a7c8ce627a7fed9374281006b79c555731",
        "json": {
          "_shards": {
            "total": 1,
            "successful": 1,
            "failed": 0
          }
        }
      },
      {
        "path": "final-verification.json",
        "sha256": "140dc658565942fef5620733d00eb4ee27c0da1c52c23f0945047689c0da4012",
        "json": {
          "runId": "1797b231-84df-4ade-9337-81f99845c0fd",
          "target": "products_write",
          "status": "PASS",
          "sourceWatermarkStart": 2,
          "sourceWatermarkEnd": 2,
          "expectedCount": 1,
          "actualCount": 1,
          "differenceCount": 0,
          "counts": {},
          "failureClass": null,
          "failureMessage": null
        }
      },
      {
        "path": "group-before-mutation.json",
        "sha256": "4a42a31b5f6a140d93262ad48d463a4e25691702d2aad6d9a1774030552f9cbe",
        "json": [
          {
            "partition": 0,
            "committed": 1,
            "end": 1,
            "lag": 0
          },
          {
            "partition": 2,
            "committed": 1,
            "end": 1,
            "lag": 0
          }
        ]
      },
      {
        "path": "group-consumer-stopped.json",
        "sha256": "4de3a1348fdddb567ad13fcd592d20789812a484d4eaa8b1fd3d002d73763cef",
        "json": [
          {
            "partition": 0,
            "committed": 1,
            "end": 1,
            "lag": 0
          },
          {
            "partition": 2,
            "committed": 1,
            "end": 2,
            "lag": 1
          }
        ]
      },
      {
        "path": "meta-after-restart.json",
        "sha256": "cc70422c266e1044bc232c967e7d221db7657a0f96e053fc3e63db88687e2128",
        "json": {
          "contract": "canal-1.1.8-file-mixed-meta-ack-cursor",
          "path": "/home/admin/canal-data/products/meta.dat",
          "destination": "products",
          "client": {
            "destination": "products",
            "client_id": 1001,
            "filter": ""
          },
          "journal": "mysql-bin.000003",
          "position": 25814,
          "timestamp": 1785382046000,
          "server_id": 1,
          "gtid": "",
          "source": {
            "address": "toxiproxy",
            "port": 8668
          },
          "slave_id": -1
        }
      },
      {
        "path": "meta-before.json",
        "sha256": "cc70422c266e1044bc232c967e7d221db7657a0f96e053fc3e63db88687e2128",
        "json": {
          "contract": "canal-1.1.8-file-mixed-meta-ack-cursor",
          "path": "/home/admin/canal-data/products/meta.dat",
          "destination": "products",
          "client": {
            "destination": "products",
            "client_id": 1001,
            "filter": ""
          },
          "journal": "mysql-bin.000003",
          "position": 25814,
          "timestamp": 1785382046000,
          "server_id": 1,
          "gtid": "",
          "source": {
            "address": "toxiproxy",
            "port": 8668
          },
          "slave_id": -1
        }
      },
      {
        "path": "mutate-http.json",
        "sha256": "8e63e0edca6875ea061d5bf3fe1f31c7d14daad58ef8a97212602e67b3d25806",
        "json": {
          "transport_exit": 0,
          "http_status": 200,
          "json_valid": true,
          "raw_body": "{\"productId\":6101,\"revision\":2}"
        }
      },
      {
        "path": "mutate.json",
        "sha256": "50695528663a8f38c7c0debabe3a34766b88f70f78c4ad4a2090d547829ad914",
        "json": {
          "productId": 6101,
          "revision": 2
        }
      },
      {
        "path": "post-restart-record.json",
        "sha256": "167b70dbb211c91597f511d4d6edd8e6e05c5191a5abca9e22bde95ee514cf73",
        "json": {
          "partition": 2,
          "offset": 1,
          "baseline_end": 1,
          "payload": {
            "data": [
              {
                "product_id": "6101",
                "revision": "2",
                "active": "1",
                "updated_at": "2026-07-30 03:27:49.925647"
              }
            ],
            "database": "product_catalog",
            "es": 1785382069000,
            "gtid": "",
            "id": 2,
            "isDdl": false,
            "mysqlType": {
              "product_id": "bigint",
              "revision": "bigint",
              "active": "tinyint(1)",
              "updated_at": "timestamp(6)"
            },
            "old": [
              {
                "revision": "1",
                "updated_at": "2026-07-30 03:27:26.517195"
              }
            ],
            "pkNames": [
              "product_id"
            ],
            "sql": "",
            "sqlType": {
              "product_id": -5,
              "revision": -5,
              "active": -6,
              "updated_at": 93
            },
            "table": "product_search_revision",
            "ts": 1785382070636,
            "type": "UPDATE"
          }
        }
      }
    ]
  }
}
