{
  "schema_version": 1,
  "scenario_id": "mapping-conflict",
  "runner_run_id": "7e98943c-995a-4c39-94ea-5823fd98b9ae",
  "declared_fault": {
    "type": "MAPPING",
    "target": "one-consumer-projection",
    "action": "emit an invalid type against the unchanged correct mapping"
  },
  "cleanup_registered_before_fault": true,
  "observed_intermediate_states": [
    "DEGRADED"
  ],
  "case_observations": {
    "scenario_id": "mapping-conflict",
    "artifacts": [
      {
        "path": "create-http.json",
        "sha256": "14aa0c3456fc85e112ea4a2ac7ba50a7eee88fb27f64f8610fd40325db0f9e74",
        "json": {
          "transport_exit": 0,
          "http_status": 201,
          "json_valid": true,
          "raw_body": "{\"productId\":7101,\"revision\":1}"
        }
      },
      {
        "path": "create.json",
        "sha256": "657f3484058a9ab26e67221400ee123c5773c0c9a8c90caccf1b1a67867fc8e0",
        "json": {
          "productId": 7101,
          "revision": 1
        }
      },
      {
        "path": "dlq-pending.json",
        "sha256": "c878b2be2d1a6b6aa786772daa8d89f0a5b76a9702708bd4e30fe1ab12b9987f",
        "json": [
          {
            "eventId": "product-search-revisions:0:4:7101",
            "topic": "product-search-revisions",
            "partition": 0,
            "offset": 4,
            "productId": 7101,
            "sourceRevision": 2,
            "payload": "{\"sku\": \"LAB-7101\", \"name\": \"Crash 7101\", \"product_id\": 7101, \"searchable\": true, \"category_id\": 10, \"description\": \"fixture\", \"price_cents\": 71101, \"category_name\": \"Accessories\", \"source_revision\": 2, \"source_updated_at\": \"2026-07-29T20:01:11.013645Z\", \"available_quantity\": 0}",
            "failureClass": "document_parsing_exception",
            "lastError": "[1:142] failed to parse field [price_cents] of type [long] in document with id '7101'. Preview of field's value: '71101-invalid'",
            "status": "PENDING",
            "attempts": 1,
            "createdAt": "2026-07-29T20:01:11.100808Z",
            "updatedAt": "2026-07-29T20:01:11.100808Z",
            "resolvedAt": null,
            "newPending": false
          }
        ]
      },
      {
        "path": "es-final.json",
        "sha256": "dec1c0d25444931c81d0fca5c082a45ab8f3f875f5c4b9112a323a951feafe77",
        "json": {
          "transport_exit": 0,
          "http_status": 200,
          "json_valid": true,
          "raw_body": "{\"_index\":\"products_v2\",\"_id\":\"7101\",\"_version\":2,\"_seq_no\":1,\"_primary_term\":1,\"found\":true,\"_source\":{\"product_id\":7101,\"sku\":\"LAB-7101\",\"name\":\"Crash 7101\",\"description\":\"fixture\",\"category_id\":10,\"category_name\":\"Accessories\",\"price_cents\":71101,\"available_quantity\":0,\"searchable\":true,\"source_revision\":2,\"source_updated_at\":\"2026-07-29T20:01:11.013645Z\"}}"
        }
      },
      {
        "path": "fault-cleared.json",
        "sha256": "931fdb79dd6f6f7087c7447c129a1f660ef939b68ce81494be8599e3b2662e62",
        "json": {
          "fault": "NONE"
        }
      },
      {
        "path": "fault.json",
        "sha256": "7e809b258c0fdcfaf6855a34614a23b5d1505b028489ecbaea796f0f82f9a0ac",
        "json": {
          "fault": "PRICE_CENTS_AS_STRING"
        }
      },
      {
        "path": "final-pipeline-status.json",
        "sha256": "c546596d55be86bc2256992caeaad3c7183193cef5af4bbc9543e1b296ec3e9a",
        "json": {
          "state": "HEALTHY",
          "kafkaLag": 0,
          "allPartitionsCommitted": true,
          "partitions": [
            {
              "topic": "product-search-revisions",
              "partition": 0,
              "committedOffset": 5,
              "beginningOffset": 0,
              "endOffset": 5,
              "lag": 0,
              "retentionGap": false
            },
            {
              "topic": "product-search-revisions",
              "partition": 1,
              "committedOffset": null,
              "beginningOffset": 0,
              "endOffset": 0,
              "lag": 0,
              "retentionGap": false
            },
            {
              "topic": "product-search-revisions",
              "partition": 2,
              "committedOffset": null,
              "beginningOffset": 0,
              "endOffset": 0,
              "lag": 0,
              "retentionGap": false
            }
          ],
          "unresolvedDlq": 0,
          "latestRunId": "95386c62-7e00-45b4-a663-c5512234df26",
          "latestRunStatus": "PASS",
          "latestDifferenceCount": 0,
          "latestRunFinishedAt": "2026-07-29T20:01:14.374763Z",
          "latestSuccessfulPassFinishedAt": "2026-07-29T20:01:14.374763Z",
          "activeConditions": [],
          "evaluatedAt": "2026-07-29T20:01:14.433377225Z"
        }
      },
      {
        "path": "final-product-dlq.json",
        "sha256": "e8ae26c00979b954051d4b766f15f9a9bb144943e999457558acaa8e39a2d73d",
        "json": {
          "unresolved": 0
        }
      },
      {
        "path": "final-record-dlq.json",
        "sha256": "e8ae26c00979b954051d4b766f15f9a9bb144943e999457558acaa8e39a2d73d",
        "json": {
          "unresolved": 0
        }
      },
      {
        "path": "final-refresh.json",
        "sha256": "a0f2dca20b849cd7f450630e46f354a7c8ce627a7fed9374281006b79c555731",
        "json": {
          "_shards": {
            "total": 1,
            "successful": 1,
            "failed": 0
          }
        }
      },
      {
        "path": "final-verification.json",
        "sha256": "f73b1419861c46b9808581aba766a4f9eb9bb64da958452ed03f2e00d95d11e7",
        "json": {
          "runId": "95386c62-7e00-45b4-a663-c5512234df26",
          "target": "products_write",
          "status": "PASS",
          "sourceWatermarkStart": 2,
          "sourceWatermarkEnd": 2,
          "expectedCount": 1,
          "actualCount": 1,
          "differenceCount": 0,
          "counts": {},
          "failureClass": null,
          "failureMessage": null
        }
      },
      {
        "path": "generation-after",
        "sha256": "b5e42a7e4f9fe2a64cae5077ee1b10905f8de414dcbff250a883650d560a5d45",
        "text": "products_v2\n"
      },
      {
        "path": "generation-before",
        "sha256": "b5e42a7e4f9fe2a64cae5077ee1b10905f8de414dcbff250a883650d560a5d45",
        "text": "products_v2\n"
      },
      {
        "path": "mutate-http.json",
        "sha256": "4312acde8d14a854bbffa36ef2dd5aa3bda7d389d6435389fdf7b56152ca0dcc",
        "json": {
          "transport_exit": 0,
          "http_status": 200,
          "json_valid": true,
          "raw_body": "{\"productId\":7101,\"revision\":2}"
        }
      },
      {
        "path": "mutate.json",
        "sha256": "3da560ae75a848c08abe8967148200e2fce7df68f6f8bfd66e572ead54ac7b37",
        "json": {
          "productId": 7101,
          "revision": 2
        }
      },
      {
        "path": "replay.json",
        "sha256": "e068e689bcf9069ec06706e6b7ea252d816ca5c73cd42a9570a06217bc52de88",
        "json": {
          "eventId": "product-search-revisions:0:4:7101",
          "priorRevision": 2,
          "currentRevision": 2,
          "outcome": "APPLIED",
          "resolved": true,
          "status": "RESOLVED"
        }
      },
      {
        "path": "status-degraded.json",
        "sha256": "b6bcdcc2ff22d3c348f76c95e88e7218787812849e7fe5b12fc986195d85c150",
        "json": {
          "state": "DEGRADED",
          "kafkaLag": 0,
          "allPartitionsCommitted": true,
          "partitions": [
            {
              "topic": "product-search-revisions",
              "partition": 0,
              "committedOffset": 5,
              "beginningOffset": 0,
              "endOffset": 5,
              "lag": 0,
              "retentionGap": false
            },
            {
              "topic": "product-search-revisions",
              "partition": 1,
              "committedOffset": null,
              "beginningOffset": 0,
              "endOffset": 0,
              "lag": 0,
              "retentionGap": false
            },
            {
              "topic": "product-search-revisions",
              "partition": 2,
              "committedOffset": null,
              "beginningOffset": 0,
              "endOffset": 0,
              "lag": 0,
              "retentionGap": false
            }
          ],
          "unresolvedDlq": 1,
          "latestRunId": null,
          "latestRunStatus": null,
          "latestDifferenceCount": 0,
          "latestRunFinishedAt": null,
          "latestSuccessfulPassFinishedAt": null,
          "activeConditions": [],
          "evaluatedAt": "2026-07-29T20:01:11.521479456Z"
        }
      }
    ]
  }
}
