{
  "schema_version": 1,
  "scenario_id": "consumer-systematic-mapping-bug",
  "runner_run_id": "882940aa-e5a4-43b6-85c3-4fbdec3dd428",
  "declared_fault": {
    "type": "MAPPING",
    "target": "consumer-category-projector",
    "action": "emit category ID as the same-revision category name"
  },
  "cleanup_registered_before_fault": true,
  "observed_intermediate_states": [
    "DEGRADED"
  ],
  "case_observations": {
    "scenario_id": "consumer-systematic-mapping-bug",
    "artifacts": [
      {
        "path": "create-http.json",
        "sha256": "908488d500bb4d6bc3d057c41a7bc5f0c4b75aaab46456b05246b9cc1333fec7",
        "json": {
          "transport_exit": 0,
          "http_status": 201,
          "json_valid": true,
          "raw_body": "{\"productId\":7701,\"revision\":1}"
        }
      },
      {
        "path": "create.json",
        "sha256": "5bddde3b05d0f7c5c1e5769ba638af89e725f67328a911be7df860aba11ee059",
        "json": {
          "productId": 7701,
          "revision": 1
        }
      },
      {
        "path": "diff-run.json",
        "sha256": "148fcabf3b7958f2f7ad6a6967b956bb873e76e8ca2ed3a9c6f32be206b2592d",
        "json": {
          "runId": "67cd2fc9-6757-485b-9a26-c9610c01388e",
          "target": "products_write",
          "status": "DIFF",
          "sourceWatermarkStart": 2,
          "sourceWatermarkEnd": 2,
          "expectedCount": 1,
          "actualCount": 1,
          "differenceCount": 1,
          "counts": {
            "MODIFIED": 1
          },
          "failureClass": null,
          "failureMessage": null
        }
      },
      {
        "path": "fault-cleared.json",
        "sha256": "931fdb79dd6f6f7087c7447c129a1f660ef939b68ce81494be8599e3b2662e62",
        "json": {
          "fault": "NONE"
        }
      },
      {
        "path": "fault.json",
        "sha256": "a26a64a16d748342a5f1fea9668f6e77f506cd3b3488515d8623cd5944501496",
        "json": {
          "fault": "CATEGORY_NAME_FROM_ID"
        }
      },
      {
        "path": "final-pipeline-status.json",
        "sha256": "f44dc19869d60755fd3184ef16378b63d48eb5b60691fe3c5b96dbef015915c1",
        "json": {
          "state": "HEALTHY",
          "kafkaLag": 0,
          "allPartitionsCommitted": true,
          "partitions": [
            {
              "topic": "product-search-revisions",
              "partition": 0,
              "committedOffset": 3,
              "beginningOffset": 0,
              "endOffset": 3,
              "lag": 0,
              "retentionGap": false
            },
            {
              "topic": "product-search-revisions",
              "partition": 1,
              "committedOffset": null,
              "beginningOffset": 0,
              "endOffset": 0,
              "lag": 0,
              "retentionGap": false
            },
            {
              "topic": "product-search-revisions",
              "partition": 2,
              "committedOffset": null,
              "beginningOffset": 0,
              "endOffset": 0,
              "lag": 0,
              "retentionGap": false
            }
          ],
          "unresolvedDlq": 0,
          "latestRunId": "5d8916e1-f115-4e43-8301-effb4fa8afcf",
          "latestRunStatus": "PASS",
          "latestDifferenceCount": 0,
          "latestRunFinishedAt": "2026-07-30T04:13:22.984647Z",
          "latestSuccessfulPassFinishedAt": "2026-07-30T04:13:22.984647Z",
          "activeConditions": [],
          "evaluatedAt": "2026-07-30T04:13:23.045803796Z"
        }
      },
      {
        "path": "final-product-dlq.json",
        "sha256": "e8ae26c00979b954051d4b766f15f9a9bb144943e999457558acaa8e39a2d73d",
        "json": {
          "unresolved": 0
        }
      },
      {
        "path": "final-record-dlq.json",
        "sha256": "e8ae26c00979b954051d4b766f15f9a9bb144943e999457558acaa8e39a2d73d",
        "json": {
          "unresolved": 0
        }
      },
      {
        "path": "final-refresh.json",
        "sha256": "a0f2dca20b849cd7f450630e46f354a7c8ce627a7fed9374281006b79c555731",
        "json": {
          "_shards": {
            "total": 1,
            "successful": 1,
            "failed": 0
          }
        }
      },
      {
        "path": "final-verification.json",
        "sha256": "67af29b9ad9b5f2f72388674c1b274a874c79a8c084b24cc3991afa54dcb8f77",
        "json": {
          "runId": "5d8916e1-f115-4e43-8301-effb4fa8afcf",
          "target": "products_write",
          "status": "PASS",
          "sourceWatermarkStart": 2,
          "sourceWatermarkEnd": 2,
          "expectedCount": 1,
          "actualCount": 1,
          "differenceCount": 0,
          "counts": {},
          "failureClass": null,
          "failureMessage": null
        }
      },
      {
        "path": "fresh-pass.json",
        "sha256": "6064c063468348079be280c44468488dec44a75b52fed841f0e828012ca7df71",
        "json": {
          "runId": "d49841bc-1b5a-44a3-a567-5c4d189df96d",
          "target": "products_write",
          "status": "PASS",
          "sourceWatermarkStart": 2,
          "sourceWatermarkEnd": 2,
          "expectedCount": 1,
          "actualCount": 1,
          "differenceCount": 0,
          "counts": {},
          "failureClass": null,
          "failureMessage": null
        }
      },
      {
        "path": "rename.json",
        "sha256": "4355a46b19d348dc2f57c046f8ef63d4538ebb936000f3c9ee954a27460dd865",
        "json": 1
      },
      {
        "path": "repair.json",
        "sha256": "9534481288988254b5327191d90b342ed430bddf0e28152ecfd994b768da722f",
        "json": {
          "runId": "67cd2fc9-6757-485b-9a26-c9610c01388e",
          "sourceWatermarkStart": 2,
          "sourceWatermarkEnd": 2,
          "applied": 1,
          "stale": 0,
          "skipped": 0,
          "failed": 0,
          "sourceStable": true,
          "repaired": true
        }
      },
      {
        "path": "status-degraded.json",
        "sha256": "873bf7d92e9ac90eb97ae4f7a12ca304044c3ff7a4be8c7d28492153fba8e0d1",
        "json": {
          "state": "DEGRADED",
          "kafkaLag": 0,
          "allPartitionsCommitted": true,
          "partitions": [
            {
              "topic": "product-search-revisions",
              "partition": 0,
              "committedOffset": 3,
              "beginningOffset": 0,
              "endOffset": 3,
              "lag": 0,
              "retentionGap": false
            },
            {
              "topic": "product-search-revisions",
              "partition": 1,
              "committedOffset": null,
              "beginningOffset": 0,
              "endOffset": 0,
              "lag": 0,
              "retentionGap": false
            },
            {
              "topic": "product-search-revisions",
              "partition": 2,
              "committedOffset": null,
              "beginningOffset": 0,
              "endOffset": 0,
              "lag": 0,
              "retentionGap": false
            }
          ],
          "unresolvedDlq": 0,
          "latestRunId": "67cd2fc9-6757-485b-9a26-c9610c01388e",
          "latestRunStatus": "DIFF",
          "latestDifferenceCount": 1,
          "latestRunFinishedAt": "2026-07-30T04:13:17.571466Z",
          "latestSuccessfulPassFinishedAt": null,
          "activeConditions": [],
          "evaluatedAt": "2026-07-30T04:13:18.130531300Z"
        }
      }
    ]
  }
}
