{"schema_version":1,"scenario_id":"canal-outage-beyond-binlog-retention","runner_run_id":"11111111-1111-4111-8111-111111111111","declared_fault":{"type":"fixture"},"cleanup_registered_before_fault":true,"observed_intermediate_states":["REBUILD_REQUIRED"],"case_observations":{"scenario_id":"canal-outage-beyond-binlog-retention","artifacts":[{"path":"gap-proof.json","sha256":"781133b639a58dd8d494e481c4e88272151040c3ea9f8d784c4b0dd4e117ca84","json":{"canal_missing_position_observed":true}},{"path":"mysql-gap-status.json","sha256":"edf8cff6f1dae49ca93069e114e354d081b25865fd8b226645d2a4831189df43","json":{"target":"mysql","recorded_present":false}},{"path":"status-gap.json","sha256":"4fcfb58c507862bc118b26efe8b300506efb064383e2ee56fc48b4cd9a704d1f","json":{"state":"REBUILD_REQUIRED"}},{"path":"recovery-required.json","sha256":"76c5a56408e7aebb0d9b3c335d47124fde10d1a9a218ed3b2b7d05b601f16f39","json":{"status":"CANAL_RECOVERY_REQUIRED"}},{"path":"recovery-started.json","sha256":"ba4ccb7aad8631f1d99fc8a644e62792f2f7a276fb3f0a6512afe49701d8178f","json":{"status":"CANAL_RECOVERING"}}]}}
